filename,category,bt5_abs_rouge1,bt5_abs_rouge2,bt5_abs_rougeL,bt5_abs_semantic_sim,mt5_abs_rouge1,mt5_abs_rouge2,mt5_abs_rougeL,mt5_abs_semantic_sim,bt5_ext_rouge1,bt5_ext_rouge2,bt5_ext_rougeL,bt5_ext_semantic_sim,mt5_ext_rouge1,mt5_ext_rouge2,mt5_ext_rougeL,mt5_ext_semantic_sim,bt5_summary,mt5_summary,abstractive_reference,extractive_reference
resume_28.txt,Skill,0.6279,0.3571,0.4651,0.9297,0.7294,0.4819,0.6353,0.8365,0.5,0.2424,0.5,0.7955,0.5373,0.2769,0.4179,0.8649,"ডাটা প্রোগ্রামিং ভাষায় পাইথন (নামপাই, সাইপাই), সি++ ও ফোরট্রান ব্যবহার করে কম্পিউটেশনাল মেকানিক্সে দক্ষতা রয়েছে, পাশাপাশি ফিনাইট এলিমেন্ট অ্যানালাইসিস এবং নিউমেরিক্যাল মেথডস ব্যবহার করে সিমুলেশন করতে পারদর্শী। ETABS, STAAD.Pro, SAP2000 সহ ওপেনসোর্স FEA লাইব্রেরি ব্যবহার করে ডেটা ভিজুয়ালাইজেশন করতে সক্ষম।","পাইথন (নামপাই, সাইপাই), সি++ এবং বেসিক ফোরট্রানসহ বিভিন্ন প্রোগ্রামিং ভাষায় দক্ষতা রয়েছে, পাশাপাশি ফিনাইট এলিমেন্ট অ্যানালাইসিস ও নিউমেরিক্যাল মেথডসের মাধ্যমে কম্পিউটেশনাল মেকানিক্সে পারদর্শী। ETABS, SAP2000 ও ওপেনসোর্স FEA লাইব্রেরি ব্যবহার করে সিমুলেশন সফটওয়্যার ডেটা ভিজুয়ালাইজেশন, ম্যাটপ্লটলিব ও ম্যাটল্যা","পাইথন (নামপাই, সাইপাই), সি++ ও বেসিক ফোরট্রানসহ প্রোগ্রামিং দক্ষতা রয়েছে, এবং ফিনাইট এলিমেন্ট অ্যানালাইসিস ও নিউমেরিক্যাল মেথডসের মাধ্যমে কম্পিউটেশনাল মেকানিক্সে পারদর্শী। ETABS, STAAD.Pro, SAP2000 এবং ওপেনসোর্স FEA লাইব্রেরি ব্যবহার করে সিমুলেশন, পাশাপাশি ম্যাটপ্লটলিব ও ম্যাটল্যাব দিয়ে ডেটা ভিজুয়ালাইজেশন করতে সক্ষম। গিট ও গিটহাবের মাধ্যমে ভার্সন কন্ট্রোল পরিচালনা এবং BNBC ও ACI সহ বিল্ডিং কোডের ধারণা রয়েছে।","প্রোগ্রামিং ল্যাঙ্গুয়েজ: পাইথন (নামপাই, সাইপাই), সি++, ফোরট্রান (বেসিক), কম্পিউটেশনাল মেকানিক্স: ফিনাইট এলিমেন্ট অ্যানালাইসিস (FEA), নিউমেরিক্যাল মেথডস, সিমুলেশন সফটওয়্যার: ETABS, STAADPro, SAP2000 (ইউজার), ওপেনসোর্স FEA লাইব্রেরি, ডেটা ভিজুয়ালাইজেশন: ম্যাটপ্লটলিব, ম্যাটল্যাব, ভার্সন কন্ট্রোল: গিট, গিটহাব, ইঞ্জিনিয়ারিং স্ট্যান্ডার্ড: Building Codes (BNBC, ACI) সম্পর্কে ধারণা"
resume_29.txt,Objective,0.7451,0.4898,0.6667,0.8109,0.8276,0.6786,0.8276,0.9536,0.5306,0.383,0.5306,0.5869,0.6429,0.3704,0.5714,0.4711,"ডাটা সার্ভিস ম্যানেজার হিসেবে কাজ করে সেবা মান উন্নত, গ্রাহক সন্তুষ্টি বৃদ্ধি এবং টিম ম্যানেজমেন্টের মাধ্যমে প্রতিষ্ঠানের লক্ষ্য অর্জনে অবদান রাখতে চাই।",আমি একটি প্রতিষ্ঠানে কাস্টমার সার্ভিস ম্যানেজার হিসেবে কাজ করে সেবা কোয়ালিটি উন্নত করতে এবং গ্রাহকের স্যাটিসফ্যাকশন বৃদ্ধি করতে চাই। টিম পরিচালনার মাধ্যমে প্রতিষ্ঠানের লক্ষ্য অর্জনে সক্রিয়ভাবে অবদান রাখতে ইচ্ছুক।,আমি কাস্টমার সার্ভিস ম্যানেজার হিসেবে কাজ করে সেবা মান উন্নত করতে এবং গ্রাহকের সন্তুষ্টি বৃদ্ধি করতে চাই। টিম পরিচালনা ও সমন্বয়ের মাধ্যমে প্রতিষ্ঠানের লক্ষ্য অর্জনে সক্রিয়ভাবে অবদান রাখতে ইচ্ছুক।,"একটি প্রতিষ্ঠানে কাস্টমার সার্ভিস ম্যানেজার হিসেবে দায়িত্ব পালন করা, যেখানে আমি সার্ভিস কোয়ালিটি উন্নত, কাস্টমার স্যাটিসফ্যাকশন বৃদ্ধি এবং টিম ম্যানেজমেন্টের মাধ্যমে প্রতিষ্ঠানের লক্ষ্য অর্জনে ভূমিকা রাখতে পারি"
resume_29.txt,Experience,0.4667,0.25,0.3778,0.8627,0.3784,0.3056,0.3784,0.8502,0.3279,0.2373,0.2951,0.6907,0.3556,0.2326,0.2667,0.6933,"প্রার্থী কুইক সেবা লিমিটেডে কাস্টমার সার্ভিস ম্যানেজার হিসেবে কাজ করছেন, যেখানে তিনি ২০ সদস্যের কাস্টমার সার্ভিস টিমের রিক্রুটমেন্ট, ট্রেনিং এবং পারফরম্যান্স ম্যানেজমেন্টের দায়িত্ব পালন করেছেন। পূর্বে কুইক সেবা লিমিটেডের মাধ্যমে ২০ সদস্যের গ্রাহক সার্ভিস টিম নিয়োগ, প্রশিক্ষণ ও পারফরম্যান্স ব্যবস্থাপনা পরিচালনা করেছেন।","মে ২০২০ থেকে কুইক সেবা লিমিটেডে কাস্টমার সার্ভিস ম্যানেজার হিসেবে ২০ সদস্যের টিমের রিক্রুটমেন্ট, ট্রেনিং এবং পারফরম্যান্স ব্যবস্থাপনায় দক্ষতা রয়েছে। এই সময়ে তিনি অভিজ্ঞতা অর্জন করেছেন।","মেই ২০২০ থেকে কুইক সেবা লিমিটেডে কাস্টমার সার্ভিস ম্যানেজার হিসেবে ২০ সদস্যের টিমের নিয়োগ, প্রশিক্ষণ ও পারফরম্যান্স ব্যবস্থাপনা করে সেবা মান উন্নয়ন ও SLA মনিটরিং করেন। পূর্বে আগস্ট ২০১৭ থেকে এপ্রিল ২০২০ পর্যন্ত কেয়ার লাইন সেন্টারে টিম লিডার হিসেবে ছোট দলকে পরিচালনা করে জটিল গ্রাহক সমস্যার সমাধান নিশ্চিত করেছেন।","২০ সদস্যের কাস্টমার সার্ভিস টিমের রিক্রুটমেন্ট, ট্রেনিং এবং performance management করা | কাস্টমার কমপ্লেইন্ট এবং ফিডব্যাক অ্যানালিসিস করে সার্ভিস উন্নয়নের পদক্ষেপ নেয়া"
resume_29.txt,Education,0.5429,0.3529,0.4,0.7545,0.5432,0.3291,0.3704,0.859,0.2069,0.0,0.1379,0.5283,0.1,0.0,0.1,0.3725,প্রার্থী ২০১৫ থেকে ২০১৭ পর্যন্ত জাতীয় বিশ্ববিদ্যালয় থেকে মার্কেটিং-এ বি.বি.এ সম্পন্ন করেছেন। সিজিপিএ ৪.০০ এর মধ্যে ৩.৪০ অর্জন করেছেন।,প্রার্থী ২০১৫ থেকে ২০১৭ পর্যন্ত জাতীয় বিশ্ববিদ্যালয় থেকে মার্কেটিং বিষয়ে এমবিএ সম্পন্ন করে ৪.০ স্কেলে ৩.৪০ জিপিএ অর্জন করেছেন। এছাড়া তিনি ম্যানেজমেন্টে বি.বি.এ (ব্যবস্থাপনায় অভিজ্ঞতা রাখেন) ডিগ্রি অর্জন করতে সক্ষম হয়েছেন।,প্রার্থী ২০১১ থেকে ২০১৫ পর্যন্ত প্রাইম ইউনিভার্সিটি থেকে ম্যানেজমেন্টে বি.বি.এ সম্পন্ন করে ৩.২৫/৪.০০ জিপিএ অর্জন করেছেন। এরপর ২০১৫ থেকে ২০১৭ পর্যন্ত জাতীয় বিশ্ববিদ্যালয় থেকে মার্কেটিংয়ে এমবিএ করে ৩.৪০/৪.০০ জিপিএ অর্জন করেছেন। তার শিক্ষাগত ফলাফল উভয় ডিগ্রিতে ধারাবাহিকভাবে উচ্চমানের।,সিজিপিএ: ৩৪০/৪০০ (২০১৫-২০১৭)
resume_29.txt,Skill,0.3043,0.0909,0.3043,0.6866,0.6667,0.45,0.6667,0.7999,0.3636,0.2581,0.3636,0.6079,0.3448,0.2222,0.3448,0.552,"প্রার্থী টিম লিডারশিপ ও ম্যানেজমেন্টে দক্ষ, পাশাপাশি কাস্টমার রিলেশনশিপ ম্যানেজমেন্ট (CRM) এবং পারফরম্যান্স মেট্রিক্স বিশ্লেষণে পারদর্শী। তিনি কনফ্লিক্ট সমাধান বিশ্লেষণের মাধ্যমে জটিল সমস্যার সমাধান করতে সক্ষম।",প্রার্থী টিম লিডারশিপ ও ম্যানেজমেন্টে দক্ষ এবং কাস্টমার রিলেশনশিপ পরিচালনা করতে পারদর্শী। তিনি performance মান বিশ্লেষণ ও সংঘাত সমাধানের ক্ষেত্রে অভিজ্ঞতা রাখেন।,প্রার্থী টিম নেতৃত্ব ও ব্যবস্থাপনায় দক্ষ এবং গ্রাহক সম্পর্ক পরিচালনায় পারদর্শী। তিনি কর্মদক্ষতার সূচক বিশ্লেষণ ও সংঘাত সমাধানের ক্ষেত্রে অভিজ্ঞতা রাখেন।,"টিম লিডারশিপ ও ম্যানেজমেন্ট, কাস্টমার রিলেশনশিপ ম্যানেজমেন্ট (CRM), performance metrics অ্যানালিসিস, conflict resolution"
resume_3.txt,Objective,0.72,0.5,0.6,0.9529,0.7347,0.5106,0.6122,0.9703,0.6522,0.5,0.6522,0.3461,0.6667,0.5116,0.6667,0.4114,প্রার্থী জুনিয়র সফ্টওয়্যার ডেভেলপার হিসেবে ক্যারিয়ার শুরু করতে ইচ্ছুক। প্রোগ্রামিং জ্ঞান ও সমস্যা সমাধানের দক্ষতা ব্যবহার করে শিখতে ও বৃদ্ধি করতে চাই।,জুনিয়র সফ্টওয়্যার ডেভেলপার হিসেবে ক্যারিয়ার শুরু করতে ইচ্ছুক। প্রোগ্রামিং জ্ঞান ও সমস্যা সমাধানের দক্ষতা ব্যবহার করে শিখতে ও বৃদ্ধি করতে চাই।,জুনিয়র সফ্টওয়্যার ডেভেলপার হিসেবে ক্যারিয়ার শুরু করে প্রোগ্রামিং জ্ঞান ও সমস্যা সমাধানের দক্ষতা ব্যবহার করতে চাই। শিখতে এবং পেশাগতভাবে উন্নতি করতে পারি এমন পরিবেশে কাজ করার লক্ষ্য রাখি।,"একজন জুনিয়র সফ্টওয়্যার ডেভেলপার হিসেবে ক্যারিয়ার শুরু করা, যেখানে আমি আমার প্রোগ্রামিং জ্ঞান এবং সমস্যা সমাধানের দক্ষতা কাজে লাগিয়ে শিখতে ও বৃদ্ধি করতে পারি"
resume_3.txt,Experience,0.6207,0.4286,0.3793,0.8399,0.7097,0.4333,0.4839,0.6799,0.6667,0.5882,0.6667,0.8355,0.55,0.4737,0.55,0.5648,ডাটা সেন্টার লিমিটেডে সফ্টওয়্যার ডেভেলপমেন্ট ইন্টার্ন হিসেবে জুন ২০২১ থেকে আগস্ট ২০২১ পর্যন্ত কোম্পানির ইন্টার্নাল ম্যানেজমেন্ট সিস্টেমের UI কম্পোনেন্ট React.js ব্যবহার করে ডেভেলপ করা হয়েছে।,আইটি সেন্টার লিমিটেডে সফ্টওয়্যার ডেভেলপমেন্ট ইন্টার্ন হিসেবে জুন ২০২১ থেকে আগস্ট ২০২১ পর্যন্ত কাজ করছেন। তিনি একটি কোম্পানির ইন্টার্নাল ম্যানেজমেন্ট সিস্টেমের UI কম্পোনেন্ট ব্যবহার করে তথ্য প্রদান করেছেন।,ইন্টার্নশিপের সময় জুন থেকে আগস্ট ২০২১ পর্যন্ত আইটি সেন্টার লিমিটেডে সফ্টওয়্যার ডেভেলপমেন্ট ইন্টার্ন হিসেবে কাজ করেছেন। তিনি React.js ব্যবহার করে কোম্পানির ইন্টার্নাল ম্যানেজমেন্ট সিস্টেমের ইউজার ইন্টারফেস কম্পোনেন্ট তৈরি করেছেন। এই প্রকল্পে UI ডেভেলপমেন্টের মূল দায়িত্ব পালন করেছেন।,সফ্টওয়্যার ডেভেলপমেন্ট ইন্টার্ন | একটি কোম্পানির ইন্টার্নাল ম্যানেজমেন্ট সিস্টেমের UI কম্পোনেন্ট Reactjs ব্যবহার করে ডেভেলপ করা
resume_3.txt,Education,0.931,0.8214,0.7931,0.9823,0.8929,0.8519,0.8929,0.9065,0.1714,0.0606,0.1714,0.7156,0.1818,0.0645,0.1818,0.5226,প্রার্থী ২০১৮ থেকে ২০২২ পর্যন্ত শাহজালাল বিজ্ঞান ও প্রযুক্তি বিশ্ববিদ্যালয় থেকে কম্পিউটার সায়েন্স ও ইঞ্জিনিয়ারিং-এ বি.এসসি. সম্পন্ন করেছেন। সিজিপিএ ৪.০০ এর মধ্যে ৩.৫০ অর্জন করেছেন।,শাহজালাল বিজ্ঞান ও প্রযুক্তি বিশ্ববিদ্যালয় থেকে ২০১৮ থেকে ২০২২ পর্যন্ত কম্পিউটার সায়েন্স ও ইঞ্জিনিয়ারিং-এ বি.এসসি. সম্পন্ন করেছেন। সিজিপিএ ৪.০০ এর মধ্যে ৩.৫০ অর্জিত।,শাহজালাল বিজ্ঞান ও প্রযুক্তি বিশ্ববিদ্যালয় থেকে ২০১৮ থেকে ২০২২ পর্যন্ত কম্পিউটার সায়েন্স ও ইঞ্জিনিয়ারিং-এ বি.এসসি. সম্পন্ন করেছেন। মোট জিপিএ ৪.০০ এর মধ্যে ৩.৫০ অর্জন করেছেন।,বিএসসি ইন কম্পিউটার সায়েন্স অ্যান্ড ইঞ্জিনিয়ারিং
resume_3.txt,Skill,0.4906,0.2745,0.3774,0.8408,0.5079,0.3279,0.4444,0.8096,0.3333,0.1176,0.3333,0.8002,0.2174,0.0909,0.1739,0.5754,"ডাটা প্রোগ্রামিং ভাষায় পাইথন, জাভা, সি এবং জাভাস্ক্রিপ্ট ব্যবহার করে ওয়েব টেকনোলজিতে দক্ষতা রয়েছে, পাশাপাশি HTML, CSS, React.js, Node.jss এবং MySQL ডাটাবেজে কাজ করতে পারদর্শী। এছাড়া Git, VS Code ও Android Studio ডেটাবেস পরিচালনার অভিজ্ঞতা রয়েছে।","প্রার্থী পাইথন, জাভা, সি এবং জাভাস্ক্রিপ্টসহ বিভিন্ন প্রোগ্রামিং ভাষায় দক্ষতা রাখেন, পাশাপাশি HTML,CSS, JavaScript, Vue.js ও node.js ব্যবহার করে ওয়েব ডেটাবেজ পরিচালনা করতে পারদর্শী। তিনি AWS ও Firebase ডাটাবেজে অভিজ্ঞতা অর্জন করে ব্যাকএন্ড ডেভেলপমেন্ট ও ভিজ্যুয়াল ডিপ্লয়মেন্টে দক্ষতার সঙ্গে কাজ করতে সক্ষম, Git, VS","প্রার্থী পাইথন, জাভা, সি এবং জাভাস্ক্রিপ্টসহ বহুমুখী প্রোগ্রামিং ভাষায় দক্ষ। তিনি HTML, CSS, React.js ও Node.js ব্যবহার করে ওয়েব ডেভেলপমেন্ট এবং MySQL ও Firebase ডাটাবেজ পরিচালনায় পারদর্শী। এছাড়া Git, VS Code এবং Android Studio টুলসের ব্যবহারেও তিনি অভিজ্ঞ।","প্রোগ্রামিং ভাষা: পাইথন, জাভা, সি, জাভাস্ক্রিপ্ট, ওয়েব টেকনোলজি: HTML, CSS, Reactjs, Nodejs, ডাটাবেজ: MySQL, Firebase, টুলস: Git, VS Code, Android Studio"
resume_30.txt,Objective,0.619,0.35,0.5714,0.8303,0.6667,0.5,0.6667,0.8961,0.5789,0.3889,0.5789,0.2699,0.6316,0.3889,0.6316,0.378,প্রার্থী মেডিকেল ইকুইপমেন্টে এমবেডেড সফটওয়্যার ও ডেটা অ্যাকুইজিশন সিস্টেম তৈরি করতে ইচ্ছুক। স্বাস্থ্যসেবা প্রযুক্তি উন্নয়নে গুরুত্বপূর্ণ ভূমিকা পালন করতে চান।,মেডিকেল ইকুইপমেন্টে এমবেডেড সফটওয়্যার ও ডেটা বিশ্লেষণ সিস্টেম তৈরি করতে ইচ্ছুক। এই মাধ্যমে স্বাস্থ্যসেবা প্রযুক্তির উন্নয়নে গুরুত্বপূর্ণ অবদান রাখতে চান।,মেডিকেল ইকুইপমেন্টে এমবেডেড সফটওয়্যার ও ডেটা সংগ্রহ ব্যবস্থা তৈরি করতে ইচ্ছুক। এই প্রযুক্তি উন্নয়নের মাধ্যমে স্বাস্থ্যসেবা ক্ষেত্রের মানোন্নয়নে সক্রিয় ভূমিকা রাখতে চান।,মেডিকেল ইকুইপমেন্টের জন্য এমবেডেড সফটওয়্যার ও ডেটা অ্যাকুইজিশন সিস্টেম ডেভেলপমেন্টের মাধ্যমে স্বাস্থ্যসেবা প্রযুক্তির উন্নয়নে গুরুত্বপূর্ণ ভূমিকা রাখতে আগ্রহী
