filename,category,bt5_abs_rouge1,bt5_abs_rouge2,bt5_abs_rougeL,bt5_abs_semantic_sim,mt5_abs_rouge1,mt5_abs_rouge2,mt5_abs_rougeL,mt5_abs_semantic_sim,bt5_ext_rouge1,bt5_ext_rouge2,bt5_ext_rougeL,bt5_ext_semantic_sim,mt5_ext_rouge1,mt5_ext_rouge2,mt5_ext_rougeL,mt5_ext_semantic_sim,bt5_summary,mt5_summary,abstractive_reference,extractive_reference
resume_73.txt,Skill,0.3929,0.1481,0.3214,0.5769,0.4211,0.2182,0.3509,0.4823,0.4286,0.2308,0.4286,0.4294,0.4138,0.1481,0.4138,0.3852,"প্রার্থী রিঅ্যাক্ট ও জাভাস্ক্রিপ্ট ব্যবহার করে ওয়েব অ্যাপ্লিকেশন তৈরি করতে পারদর্শী। তিনি টেকনিক্যাল কনটেন্ট রাইটিং, মেন্টরিং ও টিচিংয়ে দক্ষতা রাখেন।","প্রার্থী রিঅ্যাক্ট এবং জাভাস্ক্রিপ্টে দক্ষ, পাশাপাশি টেকনিক্যাল কনটেন্ট রাইটিং মডেল তৈরি করতে পারদর্শী। তিনি মেন্টরিং ও টিচিং পরিচালনা করার অভিজ্ঞতা রাখেন।","প্রার্থী রিঅ্যাক্ট এবং জাভাস্ক্রিপ্টে দক্ষ, যা আধুনিক ওয়েব ডেভেলপমেন্টে ব্যবহারযোগ্য। তিনি টেকনিক্যাল কনটেন্ট রাইটিংয়ে পারদর্শী এবং জটিল প্রযুক্তিগত বিষয় সহজভাবে উপস্থাপন করতে পারেন। এছাড়াও, মেন্টরিং ও টিচিংয়ের মাধ্যমে দলের দক্ষতা বৃদ্ধি এবং জ্ঞান ভাগাভাগি করতে সক্ষম।","রিঅ্যাক্ট, জাভাস্ক্রিপ্ট, টেকনিক্যাল কনটেন্ট রাইটিং, মেন্টরিং অ্যান্ড টিচিং"
resume_74.txt,Objective,0.8302,0.7451,0.8302,0.9533,0.7347,0.5957,0.7347,0.9612,0.8,0.6038,0.7636,0.431,0.7451,0.6122,0.7451,0.3892,"প্রার্থী ব্যাংক বা আর্থিক প্রতিষ্ঠানের আইটি বিভাগে সফটওয়্যার ইঞ্জিনিয়ার হিসেবে কাজ করতে ইচ্ছুক। এন্টারপ্রাইজ লেভেলের সফটওয়্যার রক্ষণাবেক্ষণ, ডাটাবেস ব্যবস্থাপনা এবং নেটওয়ার্ক সিকিউরিটি বিষয়ে কাজ করার সুযোগ চাই।","ব্যাংক বা আর্থিক প্রতিষ্ঠানের আইটি বিভাগে সফটওয়্যার ইঞ্জিনিয়ার হিসেবে কাজ করতে ইচ্ছুক। এন্টারপ্রাইজ লেভেল, ডাটাবেস ম্যানেজমেন্ট এবং নেটওয়ার্ক সিকিউরিটি নিয়ে কাজের সুযোগ পাবেন।","ব্যাংক বা আর্থিক প্রতিষ্ঠানের আইটি বিভাগে সফটওয়্যার ইঞ্জিনিয়ার হিসেবে কাজ করতে ইচ্ছুক। এন্টারপ্রাইজ‑লেভেলের সফটওয়্যার রক্ষণাবেক্ষণ, ডাটাবেস পরিচালনা এবং নেটওয়ার্ক সিকিউরিটি সংক্রান্ত দায়িত্ব গ্রহণের সুযোগ চাই।","একটি ব্যাংক বা আর্থিক প্রতিষ্ঠানের আইটি বিভাগে সফটওয়্যার ইঞ্জিনিয়ার হিসেবে কাজ করতে চাই, যেখানে এন্টারপ্রাইজ লেভেলের সফটওয়্যার মেইনটেনেন্স, ডাটাবেস ম্যানেজমেন্ট এবং নেটওয়ার্ক সিকিউরিটি নিয়ে কাজ করার সুযোগ পাব"
resume_74.txt,Experience,0.4444,0.2857,0.3611,0.8361,0.4578,0.2963,0.4337,0.7638,0.3784,0.2286,0.3784,0.7382,0.25,0.0435,0.1667,0.4844,"ডাটা ইঞ্জিনিয়ার হিসেবে ডাচ-বাংলা ব্যাংকে সফটওয়্যার ইঞ্জিনিয়ার হিসেবে কোর ব্যাংকিং সফটওয়্যার (ওরাকল ফাইন্যান্সিয়াল) রক্ষণাবেক্ষণ, ট্রাবলশুটিং এবং ইন্টারনাল টুলস ডেভেলপমেন্টে অভিজ্ঞতা রয়েছে।","ডাচ-বাংলা ব্যাংক লিমিটেডে সফটওয়্যার ইঞ্জিনিয়ার হিসেবে তিনি কোর ব্যাংকিং, ট্রাবলশুটিং এবং পিএইচপি ও জাভা ব্যবহার করে ইন্টারনাল টুলস ডেভেলপমেন্টে দক্ষতা রাখেন। পূর্বে তিনি ফেব্রুয়ারি ২০২১ থেকে বর্তমান পর্যন্ত এই কাজগুলো সম্পন্ন করেছেন।","ডাচ-বাংলা ব্যাংকে সফটওয়্যার ইঞ্জিনিয়ার হিসেবে কোর ব্যাংকিং সিস্টেমের রক্ষণাবেক্ষণ, ট্রাবলশুটিং এবং পিএইচপি ও জাভা ব্যবহার করে ইন্টারনাল টুলস উন্নয়ন, পাশাপাশি ওরাকল ডাটাবেস ম্যানেজমেন্ট ও রিপোর্ট জেনারেশন পরিচালনা করেন। পূর্বে আইটি কনসাল্টেন্টস লিমিটেডে জুনিয়র প্রোগ্রামার হিসেবে সরকারি ও বেসরকারি প্রকল্পের সফটওয়্যার ডেভেলপমেন্ট, সাপোর্ট, ক্লায়েন্ট সাইটে ইনস্টলেশন এবং প্রশিক্ষণ প্রদান করেছেন।",কোর ব্যাংকিং সফটওয়্যার (ওরাকল ফাইন্যান্সিয়াল) মেইনটেনেন্স ও ট্রাবলশুটিং | ডাটাবেস ম্যানেজমেন্ট (ওরাকল এসকিউএল) এবং রিপোর্ট জেনারেশন
resume_74.txt,Education,0.92,0.7917,0.8,0.9535,0.8571,0.7234,0.7347,0.8815,0.1818,0.0645,0.1818,0.5139,0.1875,0.0667,0.1875,0.4218,প্রার্থী ২০১৩ থেকে ২০১৭ পর্যন্ত ঢাকা বিশ্ববিদ্যালয় থেকে কম্পিউটার সায়েন্স ও ইঞ্জিনিয়ারিং-এ বি.এসসি সম্পন্ন করেছেন। সিজিপিএ ৪.০০ এর মধ্যে ৩.২২ অর্জন করেছেন।,প্রার্থী ২০১৩ থেকে ২০১৭ পর্যন্ত ঢাকা বিশ্ববিদ্যালয় থেকে কম্পিউটার সায়েন্স ও ইঞ্জিনিয়ারিং-এ বি.এসসি সম্পন্ন করেছেন। সিজিপিএ ৪.০০ এর মধ্যে ৩.২২ অর্জিত।,ঢাকা বিশ্ববিদ্যালয় থেকে ২০১৩ থেকে ২০১৭ পর্যন্ত কম্পিউটার সায়েন্স ও ইঞ্জিনিয়ারিং-এ বি.এসসি সম্পন্ন করেছেন। সিজিপিএ ৪.০০ স্কেলে ৩.২২ অর্জন করেছেন।,বিএসসি ইন কম্পিউটার সায়েন্স অ্যান্ড ইঞ্জিনিয়ারিং (সিএসই)
resume_74.txt,Skill,0.5417,0.3043,0.4583,0.9058,0.5556,0.3846,0.4444,0.9349,0.4444,0.16,0.4444,0.554,0.3636,0.129,0.3636,0.5072,"প্রার্থী এন্টারপ্রাইজ সফটওয়্যার সাপোর্টে পারদর্শী এবং ওরাকল এসকিউএল ও জাভা প্রোগ্রামিং ভাষায় পারদর্শী। এছাড়া, পিএইচপি দিয়ে ওয়েব ডেভেলপমেন্টে দক্ষতা রয়েছে।","প্রার্থী এন্টারপ্রাইজ সফটওয়্যার সাপোর্টে দক্ষ এবং ওরাকল এসকিউএল ব্যবহার করে ওয়েব ডেভেলপমেন্টে পারদর্শী। তিনি জাভা ও পিএইচপি ডেটাবেস পরিচালনায় অভিজ্ঞতা রাখেন। এছাড়া, পিভিপি প্রোগ্রামিংয়ে দক্ষতাও রয়েছে।","প্রার্থী এন্টারপ্রাইজ সফটওয়্যার সাপোর্টে দক্ষ এবং ওরাকল এসকিউএল, জাভা ও পিএইচপি প্রোগ্রামিং ভাষায় পারদর্শী। এই প্রযুক্তিগুলোর ব্যবহার করে তিনি জটিল সিস্টেমের রক্ষণাবেক্ষণ ও উন্নয়ন কার্যকরভাবে পরিচালনা করতে সক্ষম।","এন্টারপ্রাইজ সফটওয়্যার সাপোর্ট, ওরাকল এসকিউএল, জাভা, পিএইচপি"
resume_75.txt,Objective,0.6182,0.4151,0.5455,0.839,0.8214,0.6296,0.75,0.9718,0.5116,0.439,0.5116,0.6137,0.6818,0.6667,0.6818,0.792,প্রার্থী প্রযুক্তি প্রতিষ্ঠানে ব্যাকএন্ড সফটওয়্যার ইঞ্জিনিয়ার হিসেবে কাজ করে নির্ভরযোগ্য সার্ভারসাইড সিস্টেম তৈরি করতে ইচ্ছুক। এই লক্ষ্য অর্জনের জন্য তিনি প্রযুক্তিগত প্রতিষ্ঠানের সঙ্গে সহযোগিতা করতে চান।,প্রযুক্তি প্রতিষ্ঠানে ব্যাকএন্ড সফটওয়্যার ইঞ্জিনিয়ার হিসেবে কাজ করে নির্ভরযোগ্য এবং স্কেলেবল সার্ভার‐সাইড সিস্টেম তৈরি করতে ইচ্ছুক। এই লক্ষ্য অর্জনের মাধ্যমে প্রতিষ্ঠানের প্রযুক্তিগত উন্নয়নে অবদান রাখতে চান।,প্রযুক্তি প্রতিষ্ঠানে ব্যাকএন্ড সফটওয়্যার ইঞ্জিনিয়ার হিসেবে কাজ করে নির্ভরযোগ্য সার্ভার‑সাইড সিস্টেম তৈরি করতে ইচ্ছুক। স্কেলেবল ও কার্যকরী ব্যাকএন্ড সমাধান নির্মাণের মাধ্যমে প্রতিষ্ঠানের প্রযুক্তিগত লক্ষ্য অর্জনে অবদান রাখতে চান।,একটি প্রযুক্তি প্রতিষ্ঠানে ব্যাকএন্ড সফটওয়্যার ইঞ্জিনিয়ার হিসেবে কাজ করে নির্ভরযোগ্য এবং স্কেলেবল সার্ভার-সাইড সিস্টেম তৈরি করা
resume_75.txt,Experience,0.5306,0.4255,0.449,0.6051,0.4286,0.2963,0.3571,0.7634,0.3333,0.0909,0.25,0.5575,0.0645,0.0,0.0645,0.6491,"প্রার্থী ব্যাকএন্ড ডেভেলপার হিসেবে জানুয়ারি ২০২১ থেকে কাজ করছেন। তিনি API ডেভেলপমেন্ট, সার্ভার ম্যানেজমেন্ট এবং ডাটাবেজ অপ্টিমাইজেশনে পারদর্শী।","ব্যাকএন্ড ডেভেলপার হিসেবে জানুয়ারি ২০২১ থেকে বর্তমান পর্যন্ত কাজ করছেন, যেখানে তিনি API ও সার্ভার ম্যানেজমেন্টে দক্ষতা অর্জন করেছেন। এছাড়া ডাটাবেজ অপ্টিমাইজেশনের জন্য অভিজ্ঞতা রয়েছে।","ব্যাকএন্ড ডেভেলপার হিসেবে জানুয়ারি ২০২১ থেকে বর্তমান পর্যন্ত API ডেভেলপমেন্ট, সার্ভার ম্যানেজমেন্ট এবং ডাটাবেজ অপ্টিমাইজেশন কাজ করছেন। পূর্বে জুলাই ২০১৯ থেকে ডিসেম্বর ২০২০ পর্যন্ত জুনিয়র সফটওয়্যার ইঞ্জিনিয়ার পদে ব্যাকএন্ড ফিচার ডেভেলপমেন্টে জড়িত ছিলেন।",API ডেভেলপমেন্ট এবং সার্ভার ম্যানেজমেন্ট | জুনিয়র সফটওয়্যার ইঞ্জিনিয়ার
resume_75.txt,Education,0.7077,0.6032,0.6154,0.9056,0.6667,0.5902,0.6667,0.8371,0.3529,0.3125,0.3529,0.5766,0.375,0.3333,0.375,0.3461,প্রার্থী ২০১৫ থেকে ২০১৯ পর্যন্ত আহসানউল্লাহ ইউনিভার্সিটি অব সায়েন্স অ্যান্ড টেকনোলজি থেকে কম্পিউটার ইঞ্জিনিয়ারিং-এ বি.এসসি সম্পন্ন করেছেন। সিজিপিএ ৪.০০ এর মধ্যে ৩.৪৫ অর্জন করেছেন।,আহসানউল্লাহ ইউনিভার্সিটি অব সায়েন্স অ্যান্ড টেকনোলজি থেকে ২০১৫ থেকে ২০১৯ পর্যন্ত কম্পিউটার ইঞ্জিনিয়ারিং-এ বি.এসসি সম্পন্ন করেছেন। সিজিপিএ ৪.০০ এর মধ্যে ৩.৪৫ অর্জিত।,আহসানউল্লাহ ইউনিভার্সিটি অব সায়েন্স অ্যান্ড টেকনোল্টিতে ২০১৫ থেকে ২০১৯ পর্যন্ত কম্পিউটার ইঞ্জিনিয়ারিং-এ বি.এসসি সম্পন্ন করেছেন। সিজিপিএ ৪.০০ স্কেলে ৩.৪৫ অর্জন করেছেন। এই সময়কালে তিনি মূলত সফটওয়্যার উন্নয়ন ও সিস্টেম বিশ্লেষণে দক্ষতা অর্জন করেছেন।,আহসানউল্লাহ ইউনিভার্সিটি অব সায়েন্স অ্যান্ড টেকনোলজি
resume_75.txt,Skill,0.4651,0.1951,0.4186,0.8366,0.449,0.0851,0.3265,0.7588,0.0,0.0,0.0,0.3775,0.0,0.0,0.0,0.4805,প্রার্থী জাভা ও স্প্রিং বুট ব্যবহার করে ওয়েব অ্যাপ্লিকেশন ডেভেলপমেন্টে পারদর্শী। তিনি PostgreSQL এবং REST API ডেভেলপমেন্টে দক্ষ।,"প্রার্থী জাভা এবং Spring Boot ব্যবহার করে ওয়েব ডেভেলপমেন্টে দক্ষতা রাখেন, পাশাপাশি Postgreজ্যার ডেটাবেস পরিচালনা করতে পারদর্শী। এছাড়া তিনি রেসপনসিভ ডিপ্লয়মেন্টে অভিজ্ঞতা রয়েছে।",প্রার্থী জাভা ব্যবহার করে অ্যাপ্লিকেশন ডেভেলপমেন্টে পারদর্শী এবং Spring Boot ফ্রেমওয়ার্কে দক্ষ। তিনি PostgreSQL ডাটাবেস পরিচালনা এবং REST API নির্মাণে অভিজ্ঞতা সম্পন্ন। এসব দক্ষতা তাকে সম্পূর্ণ স্ট্যাক ব্যাকএন্ড ডেভেলপার হিসেবে উপযুক্ত করে তুলেছে।,"Java, Spring Boot, PostgreSQL, REST API Development"
resume_76.txt,Objective,0.4681,0.1333,0.2553,0.8193,0.5283,0.2745,0.4151,0.9651,0.5714,0.4,0.5714,0.4739,0.625,0.4348,0.375,0.3554,ডাটা অ্যানালিস্ট হিসেবে কাজ করে পরিসংখ্যানগত বিশ্লেষণ ও ভিজ্যুয়ালাইজেশন ব্যবহার করে ব্যবসায়িক সিদ্ধান্ত গ্রহণে কার্যকর ভূমিকা রাখতে চাই।,পরিসংখ্যানগত বিশ্লেষণ এবং ভিজ্যুয়ালাইজেশন ব্যবহার করে ব্যবসার সিদ্ধান্ত গ্রহণে সহায়তা করতে ইচ্ছুক। এই লক্ষ্য অর্জনের জন্য আমি দক্ষ ডেটা অ্যানালিস্ট হিসেবে প্রতিষ্ঠিত হতে চাই।,ডেটা বিশ্লেষণ ও ভিজ্যুয়ালাইজেশনের মাধ্যমে ব্যবসায়িক সিদ্ধান্তে সহায়তা করা আমার মূল লক্ষ্য। পরিসংখ্যানগত পদ্ধতি ব্যবহার করে কার্যকর বিশ্লেষণ প্রদান করে আমি একজন দক্ষ ডেটা অ্যানালিস্ট হিসেবে প্রতিষ্ঠিত হতে চাই।,"একজন দক্ষ ডেটা অ্যানালিস্ট হিসেবে নিজেকে প্রতিষ্ঠিত করা, যেখানে আমি পরিসংখ্যানগত বিশ্লেষণ এবং ডেটা ভিজ্যুয়ালাইজেশন ব্যবহার করে ব্যবসার সিদ্ধান্ত গ্রহণে কার্যকর ভূমিকা রাখতে পারি"
resume_76.txt,Experience,0.4839,0.3,0.3871,0.7492,0.4571,0.2353,0.3714,0.7981,0.3529,0.3125,0.3529,0.6864,0.1905,0.15,0.1905,0.5617,প্রার্থী জুনিয়র ডেটা অ্যানালিস্ট হিসেবে জানুয়ারি ২০২২ থেকে বিশাল ডেটাসেট থেকে ইনসাইট বের করে পাওয়ার বিআই (Power BI) ব্যবহার করে ড্যাশবোর্ড তৈরি করছেন।,"জুনিয়র ডেটা অ্যানালিস্ট হিসেবে জানুয়ারি ২০২২ থেকে বর্তমান পর্যন্ত বিশাল ডেটাসেট থেকে ইনসাইট বের করেছেন, পাশাপাশি Power BI ব্যবহার করে ড্যাশবোর্ড তৈরি করছেন। এই কাজের মাধ্যমে ডেটা বিশ্লেষণে দক্ষতা অর্জন করেছেন।","২০২২ থেকে জুনিয়র ডেটা অ্যানালিস্ট হিসেবে বিশাল ডেটাসেট থেকে ইনসাইট বের করে Power BI‑তে ড্যাশবোর্ড ও মাসিক রিপোর্ট প্রস্তুত করেন। ২০২১ সালে ডেটা সায়েন্স ইন্টার্ন হিসেবে ডেটা ক্লিনিং, প্রি‑প্রসেসিং এবং পাইথন‑ভিত্তিক অটোমেশন স্ক্রিপ্ট তৈরি করে বিশ্লেষণমূলক কাজের ভিত্তি গড়ে তোলেন।",পাওয়ার বিআই (Power BI) ব্যবহার করে ড্যাশবোর্ড তৈরি | বিজনেস স্টেকহোল্ডারদের জন্য মাসিক রিপোর্ট তৈরি করা
resume_76.txt,Education,0.8372,0.5854,0.6047,0.8788,0.766,0.6222,0.6809,0.8666,0.2143,0.0,0.1429,0.4695,0.1875,0.0667,0.1875,0.5313,প্রার্থী ২০১৭ থেকে ২০২১ পর্যন্ত ব্র্যাক বিশ্ববিদ্যালয় থেকে সিএসই-তে বি.এসসি সম্পন্ন করেছেন। সিজিপিএ ৪.০০ এর মধ্যে ৩.৬৫ অর্জন করেছেন।,"ব্র্যাক বিশ্ববিদ্যালয় থেকে ২০১৭ থেকে ২০২১ পর্যন্ত সিএসই-তে বি.এসসি সম্পন্ন করেছেন। সিজিপিএ ৪.০০ এর মধ্যে ৩.৬৫ অর্জন করেছেন, যা ২০১৭‐২০২১ সালে অর্জিত।","ব্র্যাক বিশ্ববিদ্যালয় থেকে ২০১৭ থেকে ২০২১ পর্যন্ত সিএসই-তে বি.এসসি সম্পন্ন করেছেন, যার সিজিপিএ ৩.৬৫ (৪.০০ স্কেলে)।","সিজিপিএ: ""৩৬৫/৪০০"" (২০১৭-২০২১)"
resume_76.txt,Skill,0.68,0.375,0.52,0.8646,0.44,0.1667,0.36,0.82,0.5,0.2,0.4375,0.7844,0.25,0.0667,0.1875,0.6255,"ডাটাবেস এবং পাইথন (Pandas, NumPy) ব্যবহার করে SQL ও নো-এসকিউএল ডেটাবেস পরিচালনা করতে পারদর্শী। তিনি Tableau/Power BI ব্যবহার করে ডেটা ভিজ্যুয়ালাইজেশন করতে সক্ষম এবং স্ট্যাটিস্টিক্যাল বিশ্লেষণে দক্ষ।","প্রার্থী পাইথন (Pandas ও NumPy) ব্যবহার করে ডেটাবেস পরিচালনা করতে পারদর্শী, পাশাপাশি Tableau ও Power BI দিয়ে ডেটা ভিজ্যুয়ালাইজেশন করতে সক্ষমতা রাখেন। এছাড়া, Tableau/Power BI‐তে ডেটা বিশ্লেষণে অভিজ্ঞতা রয়েছে।",প্রার্থী SQL ও নো‑এসকিউএল ডেটাবেসে পারদর্শী এবং পাইথনের Pandas ও NumPy লাইব্রেরি ব্যবহার করে ডেটা প্রক্রিয়াকরণে দক্ষ। তিনি Tableau ও Power BI ব্যবহার করে ডেটা ভিজ্যুয়ালাইজেশন করতে সক্ষম এবং পরিসংখ্যানিক বিশ্লেষণে অভিজ্ঞ।,"SQL এবং নো-এসকিউএল ডেটাবেস, পাইথন (Pandas, NumPy), ডেটা ভিজ্যুয়ালাইজেশন (Tableau/Power BI), স্ট্যাটিস্টিক্যাল অ্যানালাইসিস"
