filename,category,bt5_abs_rouge1,bt5_abs_rouge2,bt5_abs_rougeL,bt5_abs_semantic_sim,mt5_abs_rouge1,mt5_abs_rouge2,mt5_abs_rougeL,mt5_abs_semantic_sim,bt5_ext_rouge1,bt5_ext_rouge2,bt5_ext_rougeL,bt5_ext_semantic_sim,mt5_ext_rouge1,mt5_ext_rouge2,mt5_ext_rougeL,mt5_ext_semantic_sim,bt5_summary,mt5_summary,abstractive_reference,extractive_reference
resume_49.txt,Skill,0.5769,0.2,0.4231,0.9101,0.5714,0.4681,0.5714,0.7589,0.2963,0.0,0.2963,0.4906,0.3333,0.0,0.25,0.649,প্রার্থী সেলস ও মার্কেটিং-এ দক্ষ এবং মেডিকেল জ্ঞান (ফার্মাকোলজি) ব্যবহার করে সম্পর্ক তৈরি করতে পারদর্শী। যোগাযোগ ও উপস্থাপনা দক্ষতাও গুরুত্বপূর্ণ।,"সেলস ও মার্কেটিং ক্ষেত্রে দক্ষ এবং ফার্মাকোলজি সম্পর্কিত মেডিকেল জ্ঞান রাখেন, পাশাপাশি সম্পর্ক গঠন ও প্রক্রিয়াকরণে অভিজ্ঞতা রয়েছে।","প্রার্থী সেলস ও মার্কেটিং ক্ষেত্রে দক্ষ এবং ফার্মাকোলজি সম্পর্কিত মেডিকেল জ্ঞান রাখেন। তিনি সম্পর্ক গঠন, যোগাযোগ এবং প্রেজেন্টেশন দক্ষতায় পারদর্শী। এসব ক্ষমতা তাকে গ্রাহক সংযোগ ও বিক্রয় বৃদ্ধি করতে সক্ষম করে।","সেলস অ্যান্ড মার্কেটিং, মেডিকেল নলেজ (ফার্মাকোলজি), relationship building, communication and presentation skills"
resume_5.txt,Objective,0.8302,0.6667,0.7547,0.9528,0.84,0.7083,0.76,0.9658,0.5882,0.449,0.5882,0.4126,0.6667,0.5217,0.6667,0.4103,"প্রার্থী একটি প্রগতিশীল প্রতিষ্ঠানে মানবসম্পদ ব্যবস্থাপক হিসেবে কাজ করতে ইচ্ছুক। কৌশলগত HR পরিকল্পনা, ট্যালেন্ট অ্যাকুইজিশন ও কর্মচারী সম্পর্ক পরিচালনার মাধ্যমে প্রতিষ্ঠানের লক্ষ্য অর্জনে সক্রিয়ভাবে অবদান রাখতে চাই।","প্রগতিশীল প্রতিষ্ঠানে মানবসম্পদ ব্যবস্থাপক হিসেবে কাজ করতে ইচ্ছুক। কৌশলগত HR পরিকল্পনা, ট্যালেন্ট অ্যাকুইজিশন এবং এমপ্লয়ি রিলেশনসের মাধ্যমে প্রতিষ্ঠানের লক্ষ্য অর্জনে সক্রিয়ভাবে অবদান রাখতে চাই।","প্রগতিশীল প্রতিষ্ঠানে মানবসম্পদ ব্যবস্থাপক হিসেবে কাজ করে কৌশলগত HR পরিকল্পনা, ট্যালেন্ট অ্যাকুইজিশন এবং কর্মচারী সম্পর্ক ব্যবস্থাপনা কার্যকর করতে ইচ্ছুক। এসবের মাধ্যমে প্রতিষ্ঠানের লক্ষ্য অর্জনে সক্রিয়ভাবে অবদান রাখতে চাই।","একটি প্রগতিশীল প্রতিষ্ঠানে মানবসম্পদ ব্যবস্থাপক হিসেবে যোগদান করা, যেখানে আমি কৌশলগত HR পরিকল্পনা, ট্যালেন্ট অ্যাকুইজিশন এবং এমপ্লয়ি রিলেশনস ম্যানেজমেন্টের মাধ্যমে প্রতিষ্ঠানের লক্ষ্য অর্জনে ভূমিকা রাখতে পারি"
resume_5.txt,Experience,0.3636,0.25,0.303,0.9141,0.3768,0.209,0.3188,0.5206,0.45,0.3684,0.45,0.6843,0.4651,0.2439,0.3721,0.2572,"ডাটা ম্যানেজার হিসেবে স্টার টেকনোলজিসে এইচআর ম্যানেজার হিসেবে তিনি সম্পূর্ণ রিক্রুটমেন্ট সাইকেল পরিচালনা, জব পোস্টিং থেকে ফাইনাল সিলেকশন পর্যন্ত কাজ করছেন।","সেপ্টেম্বর ২০১৮ থেকে স্টার টেকনোলজিসে এইচআর ম্যানেজার হিসেবে কাজ করছেন। তিনি সম্পূর্ণ রিক্রুটমেন্ট সাইকেল পরিচালনা, জব পোস্টিং এবং ফাইনাল সিলেকশন পর্যন্ত অভিজ্ঞতা অর্জন করেছেন।","স্টার টেকনোলজিসে এইচআর ম্যানেজার হিসেবে তিনি সম্পূর্ণ রিক্রুটমেন্ট সাইকেল, এমপ্লয়ি অনবোর্ডিং, ট্রেনিং ও ডেভেলপমেন্ট প্রোগ্রাম, পারফরম্যান্স ম্যানেজমেন্ট সিস্টেম এবং গ্রিভেন্স হ্যান্ডলিংসহ লেবার ল কমপ্লায়েন্স নিশ্চিত করার দায়িত্ব পালন করছেন। পূর্বে মিডাস গ্রুপে এইচআর এক্সিকিউটিভ হিসেবে রিজিউম স্ক্রিনিং, ইন্টারভিউ শিডিউলিং এবং এমপ্লয়ি ডাটাবেস ম্যানেজমেন্টে কাজ করেছেন।","সম্পূর্ণ রিক্রুটমেন্ট সাইকেল ম্যানেজ করা, জব পোস্টিং থেকে ফাইনাল সিলেকশন পর্যন্ত | এমপ্লয়ি গ্রিভেন্স হ্যান্ডলিং এবং লেবার ল কমপ্লায়েন্স নিশ্চিতকরণ"
resume_5.txt,Education,0.5833,0.2571,0.3333,0.9057,0.5634,0.2609,0.3099,0.8831,0.2222,0.16,0.2222,0.3972,0.2308,0.1667,0.2308,0.2994,"প্রার্থী ২০১৩ থেকে ২০১৫ পর্যন্ত ইনডিপেন্ডেন্ট ইউনিভার্সিটি, বাংলাদেশ থেকে হিউম্যান রিসোর্স ম্যানেজমেন্টে এমবিএ সম্পন্ন করেছেন। সিজিপিএ ৪.০০ এর মধ্যে ৩.৭০ অর্জন করেছেন।","প্রার্থী ২০১৩ থেকে ২০১৫ পর্যন্ত ইনডিপেন্ডেন্ট ইউনিভার্সিটি, বাংলাদেশ থেকে ম্যানেজমেন্টে এমবিএ সম্পন্ন করেছেন। সিজিপিএ ৪.০০ স্কেলে ৩.৭০ অর্জন করেছেন (২০১৩‐২০১৫)।","প্রার্থী হিউম্যান রিসোর্স ম্যানেজমেন্টে এমবিএ করেছেন ইনডিপেন্ডেন্ট ইউনিভার্সিটি, বাংলাদেশ থেকে, যেখানে সিজিপিএ ৩.৭০/৪.০০ (২০১৩‑২০১৫) অর্জন করেছেন। এছাড়া তিনি নর্থ সাউথ ইউনিভার্সিটি থেকে ম্যানেজমেন্টে বি.বি.এ সম্পন্ন করে ৩.২০/৪.০০ সিজিপিএ (২০০৯‑২০১৩) অর্জন করেছেন। তার শিক্ষাগত ফলাফল উভয় ডিগ্রিতে ধারাবাহিকভাবে উচ্চমানের।","ইনডিপেন্ডেন্ট ইউনিভার্সিটি, বাংলাদেশ"
resume_5.txt,Skill,0.4151,0.1961,0.3774,0.6631,0.6792,0.3529,0.5283,0.8368,0.5263,0.3333,0.4737,0.351,0.5263,0.2778,0.5263,0.5359,"প্রার্থী ট্যালেন্ট অ্যাকুইজিশন, রিক্রুটমেন্ট এবং পারফরম্যান্স ম্যানেজমেন্টে দক্ষ। এইচআরএমএস (হিউম্যান রিসোর্স ম্যানেজমেন্ট সিস্টেম) ব্যবহার করে পারফরম্যান্স ম্যানেজমেন্ট, পারফরম্যান্স ম্যানেজমেন্ট এবং HRMS (Human Resource Management System) পরিচালনায় দক্ষতা রয়েছে।","প্রার্থী ট্যালেন্ট অ্যাকুইজিশন ও রিক্রুটমেন্টে দক্ষ এবং পারফরম্যান্স ম্যানেজমেন্টে পারদর্শী। তিনি এইচআরএমএস (হিউম্যান রিসোর্স ব্যবস্থা) পরিচালনা, লেবার ল ও কমপ্লায়েন্স নিয়ন্ত্রণে অভিজ্ঞতা রাখেন।","প্রার্থী ট্যালেন্ট অ্যাকুইজিশন ও রিক্রুটমেন্ট, পারফরম্যান্স ম্যানেজমেন্টে দক্ষ এবং এইচআরএমএস (Human Resource Management System) ব্যবহার করে মানবসম্পদ কার্যক্রম পরিচালনা করতে পারদর্শী। এছাড়াও তিনি লেবার ল ও কমপ্লায়েন্স সংক্রান্ত নীতিমালা মেনে কাজ করার অভিজ্ঞতা রাখেন।","ট্যালেন্ট অ্যাকুইজিশন ও রিক্রুটমেন্ট, পারফরম্যান্স ম্যানেজমেন্ট, এইচআরএমএস (হিউম্যান রিসোর্স ম্যানেজমেন্ট সিস্টেম), লেবার ল এন্ড কমপ্লায়েন্স"
resume_50.txt,Objective,0.6,0.4583,0.6,0.954,0.6923,0.56,0.6923,0.9424,0.5789,0.5,0.5789,0.5166,0.55,0.3684,0.5,0.4574,ডেটা ও টেরিটরি পারফরম্যান্স বিশ্লেষণের মাধ্যমে ফার্মাসিউটিক্যাল মার্কেটিং কৌশল উন্নয়নে সক্রিয়ভাবে অবদান রাখতে ইচ্ছুক। এই লক্ষ্য অর্জনের মাধ্যমে প্রতিষ্ঠানের সাফল্যে অবদান রাখতে চান।,বিক্রয় ডেটা ও টেরিটরি পারফরম্যান্স বিশ্লেষণ করে ফার্মাসিউটিক্যাল মার্কেটিং কৌশল উন্নয়নে সক্রিয় ভূমিকা পালন করতে ইচ্ছুক। এই লক্ষ্য অর্জনের মাধ্যমে বাজারের কার্যকারিতা বৃদ্ধি করতে চান।,বিক্রয় ডেটা ও টেরিটরি পারফরম্যান্স বিশ্লেষণ করে ফার্মাসিউটিক্যাল মার্কেটিং কৌশল উন্নয়নে অবদান রাখতে ইচ্ছুক। এই লক্ষ্য অর্জনের জন্য বিশ্লেষণাত্মক দক্ষতা ও বাজারের গভীর জ্ঞান ব্যবহার করতে চান।,বিক্রয় ডেটা ও টেরিটরি পারফরম্যান্স বিশ্লেষণের মাধ্যমে ফার্মাসিউটিক্যাল মার্কেটিং কৌশল উন্নয়নে গুরুত্বপূর্ণ ভূমিকা রাখতে আগ্রহী
resume_50.txt,Experience,0.4865,0.25,0.3514,0.7951,0.475,0.2564,0.375,0.7857,0.1538,0.04,0.1538,0.5366,0.1724,0.0357,0.1379,0.6351,"ডাটা বিশ্লেষক হিসেবে লাইফকেয়ার ফার্মা লিমিটেডে ডেটা বিশ্লেষক হিসেবে এক্সেল ও এসকিউএল ব্যবহার করে টেরিটরি ভিত্তিক বিক্রয় ডেটা সংগ্রহ, বিশ্লেষণ এবং বিশ্লেষণাত্মক কাজ করেছেন।",ডেটা বিশ্লেষক হিসেবে এপ্রিল ২০২১ থেকে লাইফকেয়ার ফার্মা লিমিটেডে এক্সেল ও এসকিউএল ব্যবহার করে টেরিটরি ভিত্তিক বিক্রয় ডেটা সংগ্রহ ও বিশ্লেষণ করেছেন। এছাড়া তিনি টস্ক্রিতে সফটওয়্যার টেস্টিং-এ অভিজ্ঞতা রাখেন।,"ডেটা বিশ্লেষক হিসেবে লাইফকেয়ার ফার্মা লিমিটেডে টেরিটরি ও প্রোডাক্ট ভিত্তিক বিক্রয় ডেটা এক্সেল ও এসকিউএল দিয়ে সংগ্রহ ও বিশ্লেষণ করে, পাওয়ার বিআইতে ড্যাশবোর্ড তৈরি করে সেলস পারফরম্যান্স পর্যবেক্ষণ ও রিপোর্ট প্রস্তুত করেছেন। পূর্বে হেলথকার প্রোডাক্টসে সেলস এক্সিকিউটিভ হিসেবে মেডিকেল ডিভাইসের বিক্রয় ডেটা এক্সেলে সংগ্রহ ও রিপোর্ট তৈরি করার অভিজ্ঞতা রয়েছে।",ডাক্তার ও ফার্মাসিস্টদের কাছে পণ্য উপস্থাপনার পর সেলস ট্রেন্ড ট্র্যাক করে রিপোর্ট তৈরি করেছি | পাওয়ার বিআই-তে ড্যাশবোর্ড তৈরি করে টেরিটরি ও প্রোডাক্ট ভিত্তিক সেলস পারফরম্যান্স মনিটর করেছি
resume_50.txt,Education,0.7727,0.5714,0.5909,0.7589,0.8095,0.65,0.7619,0.6291,0.2222,0.0,0.1481,0.481,0.24,0.0,0.16,0.495,প্রার্থী ২০১৬ থেকে ২০২০ পর্যন্ত ঢাকা বিশ্ববিদ্যালয় থেকে বি. ফার্ম (অনার্স) সম্পন্ন করেছেন। সিজিপিএ ৪.০০ এর মধ্যে ৩.২০ অর্জন করেছেন।,ঢাকা বিশ্ববিদ্যালয় থেকে ২০১৬ থেকে ২০২০ পর্যন্ত বি. ফার্ম (অনার্স) সম্পন্ন করেছেন। সিজিপিএ ৪.০০ এর মধ্যে ৩.২০ অর্জিত।,ডাক্তারি স্নাতক (অনার্স) ডিগ্রি তিনি ঢাকা বিশ্ববিদ্যালয় থেকে ২০১৬ থেকে ২০২০ পর্যন্ত সম্পন্ন করেছেন। তার সিজিপিএ ৪.০০ এর মধ্যে ৩.২০।,সিজিপিএ: ৩২০/৪০০ (২০১৬-২০২০)
resume_50.txt,Skill,0.7667,0.6207,0.7333,0.9436,0.7419,0.6333,0.7097,0.9242,0.5909,0.1905,0.3636,0.6797,0.6522,0.2273,0.4348,0.6268,"ডাটা বিশ্লেষণে এক্সেল ও বেসিক এসকিউএল ব্যবহার করে দক্ষতা রয়েছে, পাশাপাশি পাওয়ার বিআই দিয়ে ডেটা ভিজুয়ালাইজেশন করতে পারদর্শী। সেলস ডেটা অ্যানালিটিক্স এবং ফার্মাসিউটিক্যাল মার্কেটিংয়ে অভিজ্ঞতা রয়েছে।","ডেটা বিশ্লেষণে এক্সেল ও বেসিক এসকিউএল ব্যবহার করে দক্ষতা রয়েছে, পাশাপাশি পাওয়ার বিআই দিয়ে ডেটা ভিজুয়ালাইজেশন করতে পারদর্শী। সেলস ডেটা অ্যানালিটিক্স এবং ফার্মাসিউটিক্যাল মার্কেটিং মডেল তৈরি করতে সক্ষম।","ডেটা বিশ্লেষণে এক্সেল এবং বেসিক এসকিউএল ব্যবহার করে দক্ষতা রয়েছে, পাশাপাশি পাওয়ার বিআই দিয়ে ডেটা ভিজুয়ালাইজেশন করতে পারেন। সেলস ডেটা অ্যানালিটিক্স এবং ফার্মাসিউটিক্যাল মার্কেটিং ক্ষেত্রে অভিজ্ঞতা রয়েছে। তদুপরি, শক্তিশালী যোগাযোগ ও উপস্থাপনা দক্ষতা সম্পন্ন।","ডেটা অ্যানালাইসিস: এক্সেল, এসকিউএল (বেসিক), ডেটা ভিজুয়ালাইজেশন: পাওয়ার বিআই, সেলস ডেটা অ্যানালিটিক্স, ফার্মাসিউটিক্যাল মার্কেটিং, কমিউনিকেশন ও উপস্থাপনা দক্ষতা"
resume_51.txt,Objective,0.7451,0.449,0.549,0.9695,0.8293,0.7179,0.8293,0.9632,0.28,0.0417,0.24,0.2864,0.3,0.0526,0.3,0.1601,সফটওয়্যার কোম্পানিতে সফটওয়্যার ইঞ্জিনিয়ার হিসেবে কাজ করে নিজের অভিজ্ঞতা ব্যবহার করে স্কেলেবল ও কার্যকর অ্যাপ্লিকেশন তৈরি করতে ইচ্ছুক। এই লক্ষ্য অর্জনের মাধ্যমে প্রতিষ্ঠানের সাফল্যে অবদান রাখতে চান।,সফটওয়্যার ইঞ্জিনিয়ার হিসেবে কাজ করে নিজের অভিজ্ঞতা ব্যবহার করতে ইচ্ছুক। স্কেলেবেল ও কার্যকর অ্যাপ্লিকেশন তৈরি করতে চান।,সফটওয়্যার ইঞ্জিনিয়ার হিসেবে একটি সফটওয়্যার কোম্পানিতে কাজ করে নিজের অভিজ্ঞতা ব্যবহার করতে ইচ্ছুক। স্কেলেবেল ও কার্যকর অ্যাপ্লিকেশন তৈরি করে পেশাগত লক্ষ্য অর্জন করতে চান।,লক্ষ্যঃ  একটি সফটওয়্যার কোম্পানিতে সফটওয়্যার ইঞ্জিনিয়ার হিসেবে কাজ করার মাধ্যমে নিজের অভিজ্ঞতাসমূহের প্রতিফলন ঘটানো এবং সেই অনুযায়ী স্কেলেবেল এবং কার্যকর এপ্লিকেশন তৈরি করা
resume_51.txt,Experience,0.6269,0.3692,0.4776,0.2043,0.75,0.4857,0.6111,0.9673,0.2162,0.0571,0.2162,0.5386,0.1429,0.0,0.1429,0.6323,"প্রার্থী ২০২৩ থেকে বর্তমান পর্যন্ত বাইটকেয়ারে সফটওয়্যার ইঞ্জিনিয়ার হিসেবে কাজ করছেন, যেখানে তিনি ওয়েব অ্যাপ্লিকেশন ডেভেলপমেন্ট, টেকনোভা (২০২২২০২৩) এবং কোডসফটে জুনিয়র ডেভেলপার হিসেবে এপিআই ইন্টিগ্রেশন করেছেন।","বাইটকেয়ারে সফটওয়্যার ইঞ্জিনিয়ার হিসেবে ২০২৩ থেকে বর্তমান পর্যন্ত কাজ করছেন, যেখানে তিনি ওয়েব অ্যাপ্লিকেশন ডেভেলপমেন্টে দক্ষ এবং এপিআই ইন্টিগ্রেশন করেছেন। পূর্বে কোডসফট-এ জুনিয়র ডেভেলেপার পদে অভিজ্ঞতা অর্জন করেছেন (২০২০‐২০২২)।","বাইটকেয়ারে সফটওয়্যার ইঞ্জিনিয়ার হিসেবে ২০২৩ থেকে বর্তমানে কাজ করছেন, যেখানে তিনি ওয়েব অ্যাপ্লিকেশন ডেভেলপমেন্টে জড়িত। পূর্বে টেকনোভা-তে ২০২২‑২০২৩ সালে এপিআই ইন্টিগ্রেশন এবং ওয়েব ডেভেলপমেন্টের দায়িত্ব পালন করেছেন। এছাড়া, কোডসফট-এ জুনিয়র ডেভেলপার হিসেবে ২০২০‑২০২২ পর্যন্ত অভিজ্ঞতা অর্জন করেছেন।","সফটওয়্যার ইঞ্জিনিয়ার, বাইটকেয়ার, (২০২৩-বর্তমান) | ওয়েব এপ্লিকেশন ডেভেলপমেন্ট, টেকনোভা (২০২২-২০২৩)"
resume_51.txt,Education,0.8718,0.8108,0.8718,0.8961,0.84,0.8333,0.84,0.7885,0.0,0.0,0.0,0.4745,0.0,0.0,0.0,0.5079,প্রার্থী ঢাকা বিশ্ববিদ্যালয় থেকে সি.এস.ই সম্পন্ন করেছেন। সিজিপিএ ৪.০০ এর মধ্যে ৩.৬৫ অর্জন করেছেন।,"ঢাকা বিশ্ববিদ্যালয় থেকে সি.এস.ই. বিষয়ে বি. এস.সি. সম্পন্ন করেছেন। সিজিপিএ ৪.০০ এর মধ্যে ৩.৬৫ অর্জন করেছেন, যা ২০১৮ থেকে ২০২০ পর্যন্ত শিক্ষাকালকে অন্তর্ভুক্ত করে।",ঢাকা বিশ্ববিদ্যালয় থেকে সি.এস.ই. বিষয়ে বি.এস.সি. সম্পন্ন করেছেন। সিজিপিএ ৪.০০ এর মধ্যে ৩.৬৫ অর্জন করেছেন।,সিজিপিএঃ “৩৬৫/৪০০”
